{
  "schema_version": "1.0.0",
  "scorecard_id": "work1-award-scorecard-recalibration-2026-08-13",
  "work_id": "WORK1",
  "work_title": "山口県 市町別の登録供給ビュー",
  "evaluation_as_of": "2026-08-13",
  "evidence_boundary": {
    "repository_id": "yyy-yuichi/yamaguchi-yusho-data",
    "other_work_input_count": 0,
    "policy": "この作品の公開物と公式要項だけを入力にし、他作品のパス・URL・ファイル・得点を参照しない。",
    "decision_owner": "human"
  },
  "official_source": {
    "title": "アーバンデータチャレンジ2026 作品募集要領",
    "url": "https://urbandata-challenge.jp/udc2026_entry",
    "page_updated_at": "2026-06-20",
    "verified_at": "2026-08-12",
    "numeric_weights_published": false
  },
  "classification": {
    "work_type": "アプリケーション",
    "theme": "道路・交通",
    "priority_field": true,
    "priority_treatment": "2026年度の重点分野。公式要項は重点分野の作品に作品審査の優遇措置があると説明している。"
  },
  "scoring_method": {
    "scale_min": 0.0,
    "scale_max": 5.0,
    "step": 0.5,
    "criterion_rounding": "nearest_0.5_half_up",
    "overall_formula": "mean(criteria.score) / 5 * 100",
    "official_score": false,
    "warning": "この指数は共通形式で差分を見つけるための内部診断値で、UDC事務局の公式点、順位、受賞確率ではない。"
  },
  "criteria": [
    {
      "criterion_id": "utility",
      "label": "実用度",
      "official_definition": "設定課題・創出価値に対して、作品が提示する「方法」に妥当性があるかを評価",
      "official_weight": null,
      "comparison_weight": 0.3333333333333333,
      "score": 3.5,
      "confidence": "medium",
      "rationale": "分散した登録簿と公式GTFSを、市町・日付・根拠・限界を保った一つの入口へまとめ、4状態に応じた協議前ハンドオフへつなぐ方法は課題に整合する。一方、想定利用者が実務時間を短縮できたことや意思決定に使えたことを示す外部利用者証拠はまだない。",
      "evidence": [
        {
          "claim": "公開説明が課題、想定利用者、3段階の利用方法、分かることと分からないことを示す。",
          "url": "https://yyy-yuichi.github.io/yamaguchi-yusho-data/entry.html",
          "evidence_type": "public_demo",
          "as_of": "2026-08-12"
        },
        {
          "claim": "19市町から選び、登録供給と公式GTFS確認状況を同じ画面で追跡できる。",
          "url": "https://yyy-yuichi.github.io/yamaguchi-yusho-data/",
          "evidence_type": "public_demo",
          "as_of": "2026-08-12"
        },
        {
          "claim": "選択市町を4状態に分け、共有事実・次の確認・分析へ渡す条件を、共有・印刷できる確認メモとして公開している。",
          "url": "https://yyy-yuichi.github.io/yamaguchi-yusho-data/municipality-memo.html",
          "evidence_type": "public_demo",
          "as_of": "2026-08-13"
        }
      ],
      "missing_evidence": [
        "県・市町の交通担当者または交通事業者によるタスク実施結果",
        "従来手順との所要時間または見落とし件数の比較",
        "公開情報の確認後に実際の調査・協議へつながった事例"
      ],
      "as_of": "2026-08-13",
      "subcriteria": [
        {
          "subcriterion_id": "problem_value_clarity",
          "label": "課題と創出価値の明確さ",
          "score": 4.0,
          "confidence": "high",
          "rationale": "登録簿とGTFSの公開場所・数え方・日付の違いを、確認前の具体的な障害として説明している。",
          "evidence": [
            {
              "claim": "課題、対象者、価値を公開説明ページで明示している。",
              "url": "https://yyy-yuichi.github.io/yamaguchi-yusho-data/entry.html#problem-title",
              "evidence_type": "public_demo",
              "as_of": "2026-08-12"
            }
          ],
          "missing_evidence": ["課題の頻度や作業負担を示す外部調査"],
          "as_of": "2026-08-13"
        },
        {
          "subcriterion_id": "method_fit",
          "label": "方法の妥当性",
          "score": 4.5,
          "confidence": "high",
          "rationale": "市町選択、GTFS状況、同一週の2フィード比較、原本・日付・限界への導線に加え、4状態別に共有事実・次の確認・分析条件を示すメモが、交通協議前に公開情報を取り違えず確認する目的へ直接対応する。",
          "evidence": [
            {
              "claim": "公開アプリが市町別確認と同一週比較を実装している。",
              "url": "https://yyy-yuichi.github.io/yamaguchi-yusho-data/",
              "evidence_type": "public_demo",
              "as_of": "2026-08-12"
            },
            {
              "claim": "確認結果を根拠・日付・限界に加え、状態別の共有事実・次の確認・分析条件を含む市町別メモへ渡せる。",
              "url": "https://yyy-yuichi.github.io/yamaguchi-yusho-data/municipality-memo.html",
              "evidence_type": "public_demo",
              "as_of": "2026-08-13"
            }
          ],
          "missing_evidence": ["実務タスクに対する方法選択の第三者評価"],
          "as_of": "2026-08-13"
        },
        {
          "subcriterion_id": "user_value_evidence",
          "label": "利用者価値の実証",
          "score": 2.0,
          "confidence": "medium",
          "rationale": "想定利用者と利用手順は具体的だが、利用者本人による評価、利用ログ、意思決定成果はまだ公開されていない。",
          "evidence": [
            {
              "claim": "県・市町担当者と交通事業者を想定利用者として公開している。",
              "url": "https://yyy-yuichi.github.io/yamaguchi-yusho-data/entry.html#user-title",
              "evidence_type": "public_demo",
              "as_of": "2026-08-12"
            }
          ],
          "missing_evidence": ["想定利用者の観察・インタビュー・アンケート", "実務上の時間短縮または判断改善"],
          "as_of": "2026-08-13"
        }
      ]
    },
    {
      "criterion_id": "completeness",
      "label": "完成度",
      "official_definition": "作品の「目的」を具現化する「方法」がどこまで具体実装・実施されているか、その完成度で評価",
      "official_weight": null,
      "comparison_weight": 0.3333333333333333,
      "score": 4.0,
      "confidence": "high",
      "rationale": "公開デモ、4状態別の市町確認メモ、機械可読データ、コード、出典、検証状況、原本変更検知、同一HEADの外部attestationまで稼働している。主要用途は実装済みだが、GTFS関連確認6/19市町、関連実測表示3市町・実測2フィードという範囲制限と外部利用実績の不足が残る。",
      "evidence": [
        {
          "claim": "公開アプリ、応募説明、検証状況、公開JSONへ第三者が到達できる。",
          "url": "https://yyy-yuichi.github.io/yamaguchi-yusho-data/status.html",
          "evidence_type": "public_verification",
          "as_of": "2026-08-12"
        },
        {
          "claim": "コード、データ、テスト、履歴が公開リポジトリにある。",
          "url": "https://github.com/yyy-yuichi/yamaguchi-yusho-data",
          "evidence_type": "source_code",
          "as_of": "2026-08-12"
        }
      ],
      "missing_evidence": [
        "県内すべての交通事業者・移動サービスの網羅",
        "公式資料で未確認の13市町に対する追加確認",
        "公開後の利用者環境での長期可用性実績"
      ],
      "as_of": "2026-08-13",
      "subcriteria": [
        {
          "subcriterion_id": "public_implementation",
          "label": "利用可能な公開実装",
          "score": 4.5,
          "confidence": "high",
          "rationale": "静的Webアプリとして公開され、登録供給、GTFS確認状況、2フィードの同一週比較に加え、4状態別の市町確認メモを共有・印刷できる。",
          "evidence": [
            {
              "claim": "主要機能を公開URLで利用できる。",
              "url": "https://yyy-yuichi.github.io/yamaguchi-yusho-data/",
              "evidence_type": "public_demo",
              "as_of": "2026-08-12"
            },
            {
              "claim": "19市町の確認メモを公開JSONから4状態別に生成し、共有・印刷できる。",
              "url": "https://yyy-yuichi.github.io/yamaguchi-yusho-data/municipality-memo.html",
              "evidence_type": "public_demo",
              "as_of": "2026-08-13"
            }
          ],
          "missing_evidence": ["支援技術利用者を含む外部ユーザー受入"],
          "as_of": "2026-08-13"
        },
        {
          "subcriterion_id": "reproducibility_verifiability",
          "label": "再現性と検証可能性",
          "score": 4.5,
          "confidence": "high",
          "rationale": "公開JSON、原本SHA256、処理コード、テスト、検証記録、週次のread-only原本照合、同一HEADの外部attestationがあり、数値と根拠を追跡できる。",
          "evidence": [
            {
              "claim": "検証状況ページが出典、データ、完了条件、継続照合へ接続する。",
              "url": "https://yyy-yuichi.github.io/yamaguchi-yusho-data/status.html",
              "evidence_type": "public_verification",
              "as_of": "2026-08-12"
            },
            {
              "claim": "原本変更検知を週次・手動で実行できる。",
              "url": "https://github.com/yyy-yuichi/yamaguchi-yusho-data/actions/workflows/source-freshness.yml",
              "evidence_type": "public_verification",
              "as_of": "2026-08-12"
            }
          ],
          "missing_evidence": ["別実装者がゼロから再生成した独立再現記録"],
          "as_of": "2026-08-13"
        },
        {
          "subcriterion_id": "scope_reliability",
          "label": "目的範囲の充足と信頼性",
          "score": 3.5,
          "confidence": "high",
          "rationale": "山口県19市町の登録簿ビューはあるが、GTFSは公式関係を確認できた6/19市町、関連実測表示3市町・実測2フィードに限定され、全公共交通を網羅しない。",
          "evidence": [
            {
              "claim": "公開GTFS確認データが関連確認6/19市町と未確認13/19市町を区別する。",
              "url": "https://yyy-yuichi.github.io/yamaguchi-yusho-data/data/municipality_gtfs.json",
              "evidence_type": "public_data",
              "as_of": "2026-08-12"
            },
            {
              "claim": "比較指標は岩国市関連・光市関連の2フィードに限定される。",
              "url": "https://yyy-yuichi.github.io/yamaguchi-yusho-data/data/gtfs_supply_metrics.json",
              "evidence_type": "public_data",
              "as_of": "2026-08-12"
            }
          ],
          "missing_evidence": ["未確認13市町の追加調査", "認証が必要なGTFS本体の検証", "県内全交通モードの範囲定義"],
          "as_of": "2026-08-13"
        }
      ]
    },
    {
      "criterion_id": "challenge",
      "label": "挑戦度",
      "official_definition": "目的や方法の新規性、アウトプットの網羅性、期間的な持続・継続性、関係アクターの多様性等をチャレンジ要素として評価",
      "official_weight": null,
      "comparison_weight": 0.3333333333333333,
      "score": 3.0,
      "confidence": "medium",
      "rationale": "異なる制度資料とGTFSを、日付と限界を失わず接続し、市町別確認メモと継続照合まで実装した。国内3サービス・6一次資料との限定比較で前段の確認層という役割差も示した。一方、新規採用フィードは0件で、GTFS実測の網羅性と関係アクターの多様性は弱い。",
      "evidence": [
        {
          "claim": "登録供給と予定運行を同じ入口で示し、異なる単位を順位へ丸めない。",
          "url": "https://yyy-yuichi.github.io/yamaguchi-yusho-data/entry.html#criteria-title",
          "evidence_type": "public_demo",
          "as_of": "2026-08-12"
        },
        {
          "claim": "受入済み原本を自動更新せず継続照合する仕組みが公開されている。",
          "url": "https://yyy-yuichi.github.io/yamaguchi-yusho-data/status.html#freshness-title",
          "evidence_type": "public_verification",
          "as_of": "2026-08-12"
        },
        {
          "claim": "国内3サービス・6一次資料を同じ観点で比較し、作品①を深い分析の前段にある確認層として限定的に位置づけている。",
          "url": "https://yyy-yuichi.github.io/yamaguchi-yusho-data/entry.html#benchmark-title",
          "evidence_type": "public_verification",
          "as_of": "2026-08-13"
        }
      ],
      "missing_evidence": [
        "今回の3サービスを越える追加比較または第三者による位置づけ評価",
        "GTFS実測対象の広域化",
        "行政・事業者・市民等との共同設計または継続運用"
      ],
      "as_of": "2026-08-13",